id_metier,verbatim
OP063,"Je conçois et valide des architecures qui permettent de répondre durablement aux exigences des métiers tout en respectant le SDSI et l'urbanisation du SI, en corrélation avec l'urbaniste des SIs"
OP063,"Je configure l'automatisation des déploiements DevOps."
OP063,"Je conçois des architectures logicielles basées sur Java et Angular."
OP063,"Je définis les standards de programmation et les frameworks à utiliser."
OP063,"Je travaille sur le design de micro-services complexes."
